id,meta_title,meta_descr,alt,title,slug,body,image,updated,created,author
8,"Галицька правнича група: Позика між фізичними особами: як себе захистити, юридичні аспекти та нюанси договору позики","Галицька правнича група - Правове регулювання договору позики, як правильно оформити договір позики, допомога в оформленні договорів, консалтинг, представництво в суді, стягнення за договорами позики",Позика_коштів,Як оформити позику грошей між фізичними особами?,posyka_koshtiv,"<h1 class=""MsoNormal"" style=""text-align: justify; line-height: 150%; font-size: 15px; color: #0d0909; text-indent: 35.45pt;""><span lang=""UK"" style=""color: #000000; background-color: #ffffff;"">Договір позики, юридична консультація, правовий супровід, консалтинг</span></h1>
<p>&nbsp;</p>
<p><span lang=""UK"" style=""color: #000000; background-color: #ffffff;"">&nbsp; &nbsp; &nbsp; &nbsp; &nbsp;&nbsp;</span></p>
<h2 class=""MsoNormal"" style=""margin-bottom: .0001pt; text-align: justify;""><strong><u><span style=""font-size: 12.0pt; line-height: 115%; font-family: 'Times New Roman','serif';"">&nbsp; &nbsp; &nbsp; &nbsp; &nbsp; &nbsp; &nbsp;Адвокати у Львові, Тернополі, Луцьку, Івано-Франківську до Ваших послуг.</span></u></strong></h2>
<h2 class=""MsoNormal"" style=""text-align: justify; line-height: 150%; font-size: 15px; color: #0d0909; text-indent: 35.45pt;""><span lang=""UK"" style=""color: #000000; background-color: #ffffff;"">Основні аспекти інституту договору позики викладено в главі 71 Цивільного кодексу України.</span></h2>
<p class=""rvps2"" style=""text-align: justify; line-height: 150%; color: #0d0909; font-size: 15px; text-indent: 35.45pt; background-color: #ffffff; margin: 0cm 0cm 6.0pt 0cm;""><span lang=""UK"" style=""color: #000000; background-color: #ffffff;"">Так, згідно ст.1046 ЦКУ за договором позики одна сторона (позикодавець) передає у власність другій стороні (позичальникові) грошові кошти або інші речі, визначені родовими ознаками, а позичальник зобов'язується повернути позикодавцеві таку ж суму грошових коштів (суму позики) або таку ж кількість речей того ж роду та такої ж якості. </span><a name=""n4905""></a><span style=""color: #000000; background-color: #ffffff;"">Договір позики є укладеним з моменту передання грошей або інших речей, визначених родовими ознаками.</span></p>
<h2 class=""rvps2"" style=""text-align: justify; line-height: 150%; font-size: 15px; color: #0d0909; text-indent: 35.45pt; background-color: white; margin: 0cm 0cm 6.0pt 0cm;""><span style=""color: #000000; background-color: #ffffff;"">Договір позики укладається у письмовій формі,<span lang=""UK""> у таких випадках:</span></span></h2>
<p class=""rvps2"" style=""text-align: justify; line-height: 150%; color: #0d0909; font-size: 15px; text-indent: -24.55pt; mso-list: l0 level1 lfo1; background: #FFFFFF; margin: 0cm 0cm .0001pt 35.45pt;""><span style=""color: #000000; background-color: #ffffff;""><!-- [if !supportLists]--><span lang=""UK"" style=""font-family: Wingdings;""><span style=""mso-list: Ignore;"">&Oslash;<span style=""font: 7pt 'Times New Roman'; background-color: #ffffff;"">&nbsp;&nbsp; </span></span></span><!--[endif]-->якщо його сума не менш як у десять разів перевищує встановлений законом розмір неоподатковуваного мінімуму доходів громадян, </span></p>
<p class=""rvps2"" style=""text-align: justify; line-height: 150%; font-size: 15px; text-indent: -24.65pt; mso-list: l0 level1 lfo1; background: white; margin: 0cm 0cm 6.0pt 35.4pt;""><span style=""color: #000000; background-color: #ffffff;""><!-- [if !supportLists]--><span lang=""UK"" style=""font-family: Wingdings;""><span style=""mso-list: Ignore;"">&Oslash;<span style=""font: 7pt 'Times New Roman'; background-color: #ffffff;"">&nbsp;&nbsp; </span></span></span><!--[endif]-->у випадках, коли позикодавцем є юридична особа, - незалежно від суми.</span></p>
<p class=""rvps2"" style=""margin: 0cm; line-height: 150%; font-size: 15px; margin-bottom: .0001pt; text-align: justify; text-indent: 35.45pt; background: white;""><span lang=""UK"" style=""color: #000000; background-color: #ffffff;"">Для цілей цієї норми закону застосовується показник неоподатковуваного мінімуму доходів громадян розміром у 17 гривень, встановлений пунктом 5 підрозділу 1 розділу XX Податкового кодексу України.</span></p>
<p class=""rvps2"" style=""margin: 0cm; line-height: 150%; font-size: 15px; margin-bottom: .0001pt; text-align: justify; text-indent: 35.45pt; background: white;""><a name=""n4908""></a><span style=""color: #000000; background-color: #ffffff;"">На підтвердження укладення договору позики та його умов може бути представлена розписка позичальника або інший документ, який посвідчує передання йому позикодавцем визначеної грошової суми або визначеної кількості речей.</span></p>
<p class=""rvps2"" style=""margin: 0cm; line-height: 150%; font-size: 15px; margin-bottom: .0001pt; text-align: justify; text-indent: 35.45pt; background: white;""><span style=""color: #000000; background-color: #ffffff;""><span lang=""UK"">Отже, позику грошей у сумі понад 170 грн. між фізичними особами можна укласти шляхом видачі розписки позичальника. </span><span style=""background-image: initial; background-position: initial; background-size: initial; background-repeat: initial; background-attachment: initial; background-origin: initial; background-clip: initial;"">Правильно складений документ може бути прийнятий в суді як доказ. Однак потрібно розуміти, що юридична сила розписки повністю залежить від її грамотного складання.</span></span></p>
<p class=""rvps2"" style=""margin: 0cm; line-height: 150%; font-size: 15px; margin-bottom: .0001pt; text-align: justify; text-indent: 35.45pt; background: white;""><span lang=""UK"" style=""color: #000000; background-color: #ffffff;"">Найперше, що необхідно пам&rsquo;ятати &ndash; бажано, щоб цей документ був написаний власноруч. Законодавством не встановлено правила написання розписки. Юридичну силу матимуть обидва варіанти, як рукописний, так і машинописний, однак при зверненні до суду, для того, щоб однозначно ідентифікувати особу &ndash; позичальника, необхідними є не тільки прізвище, ім&rsquo;я, по батькові, паспортні дані, та ідентифікаційний номер платника податків, але і зразок підпису, а іноді і почерку людини. В такому випадку розписка, оформлена рукописним текстом, буде повноцінною гарантією того, що позичальник (боржник) не зможе посилатися на те, що він не брав грошей під розписку.</span></p>
<h2 class=""rvps2"" style=""margin: 0cm; line-height: 150%; font-size: 15px; margin-bottom: .0001pt; text-align: justify; text-indent: 35.45pt; background: white;""><span lang=""UK"" style=""color: #000000; background-color: #ffffff;"">Також у розписці варто вказувати адреси реєстрації та місця проживання сторін. Ця інформація також стане у пригоді у випадку необхідності звернення до суду.</span></h2>
<p class=""rvps2"" style=""margin: 0cm; line-height: 150%; font-size: 15px; margin-bottom: .0001pt; text-align: justify; text-indent: 35.45pt; background: white;""><span lang=""UK"" style=""color: #000000; background-color: #ffffff;"">Суму грошей, які були передані в борг, слід вказати цифрами та прописом, а також вказати валюту, в якій передаються гроші.</span></p>
<p class=""rvps2"" style=""margin: 0cm; line-height: 150%; font-size: 15px; margin-bottom: .0001pt; text-align: justify; text-indent: 35.45pt; background: white;""><span lang=""UK"" style=""color: #000000; background-color: #ffffff;"">Частиною першою ст. 192 ЦКУ визначено, що законним платіжним засобом, обов'язковим до приймання за номінальною вартістю на всій території України, є грошова одиниця України &ndash; гривня.</span></p>
<p class=""rvps2"" style=""margin: 0cm; line-height: 150%; font-size: 15px; margin-bottom: .0001pt; text-align: justify; text-indent: 35.45pt; background: white;""><span lang=""UK"" style=""color: #000000; background-color: #ffffff;"">Однак, це не забороняє сторонам зазначити у розписці суму у іноземній валюті, наприклад євро чи долар США, як розмір позики, який підлягає поверненню, за умови, що повернення цієї суми у іноземній валюті буде здійснюватися за еквівалентом в національній валюті за офіційним курсом Національного банку України гривні до іноземної валюти (або іншого банку за погодженням між сторонами) станом на день повернення позики.</span></p>
<p class=""rvps2"" style=""margin: 0cm; line-height: 150%; font-size: 15px; margin-bottom: .0001pt; text-align: justify; text-indent: 35.45pt; background: white;""><span lang=""UK"" style=""color: #000000; background-color: #ffffff;"">Для того щоб в подальшому боржник не міг послатися на те, що це був подарунок, рекомендуємо вказувати мету позики.</span></p>
<p class=""rvps2"" style=""margin: 0cm; line-height: 150%; font-size: 15px; margin-bottom: .0001pt; text-align: justify; text-indent: 35.45pt; background: white;""><span lang=""UK"" style=""color: #000000; background-color: #ffffff;"">Не завадить вказати порядок повернення позики, наприклад частинами щомісяця до певного числа поточного місяця або всю суму до конкретної дати. Разом з тим, якщо сторони не зазначили строк повернення позики, це не позбавляє права Позикодавця звернутися до Позичальника із письмовою вимогою у будь-який час. В такому випадку, позика має бути повернена Позичальником протягом тридцяти днів від дня пред'явлення позикодавцем вимоги про це.</span></p>
<p class=""rvps2"" style=""margin: 0cm; line-height: 150%; font-size: 15px; margin-bottom: .0001pt; text-align: justify; text-indent: 35.45pt; background: white;""><span style=""color: #000000; background-color: #ffffff;""><span lang=""UK"">За погодженням сторін, у розписці<span style=""mso-spacerun: yes;"">&nbsp; </span>може бути зазначено розмір і порядок отримання Позикодавцем процентів за користування предметом позики Позичальником.</span> <span lang=""UK"">Якщо договором не встановлений розмір процентів, їх розмір визначається на рівні облікової ставки Національного банку України.</span></span></p>
<p class=""rvps2"" style=""margin: 0cm; line-height: 150%; font-size: 15px; margin-bottom: .0001pt; text-align: justify; text-indent: 35.45pt; background: white;""><span lang=""UK"" style=""color: #000000; background-color: #ffffff;"">Гроші в борг під розписку рекомендуємо давати при свідках, які надалі зможуть підтвердити факт передачі вами грошей боржнику. Тому бажано вказати дані, які допоможуть ідентифікувати їх надалі, і особистий підпис. Свідком може бути кожна дієздатна особа, якій відомі будь-які обставини, що стосуються справи.</span></p>
<p class=""rvps2"" style=""margin: 0cm; line-height: 150%; font-size: 15px; margin-bottom: .0001pt; text-align: justify; text-indent: 35.45pt; background: white;""><span lang=""UK"" style=""color: #000000; background-color: #ffffff;"">Варто також зауважити, що у розписці неприпустимими є виправлення і закреслення. У випадку допущення незначної помилки виправлення можна завірити написом &laquo;виправленому вірити&raquo; та підписами сторін, однак краще все-таки переписати.</span></p>
<p class=""rvps2"" style=""margin: 0cm; line-height: 150%; font-size: 15px; margin-bottom: .0001pt; text-align: justify; text-indent: 35.45pt; background: white;""><span lang=""UK"" style=""color: #000000; background-color: #ffffff;"">У випадку прострочення повернення позики, на суму заборгованості може бути нараховано Позикодавцем встановлений індекс інфляції за весь час прострочення, а також три проценти річних від простроченої суми.</span></p>
<p class=""rvps2"" style=""margin: 0cm; line-height: 150%; font-size: 15px; margin-bottom: .0001pt; text-align: justify; text-indent: 35.45pt; background: white;""><span lang=""UK"" style=""color: #000000; background-color: #ffffff;"">Звернення до суду за стягнення простроченої позики, процентів за її користування і штрафних санкцій може бути здійснено Позикодавцем у будь-який момент в межах строків позовної давності, коли останній дізнався про його порушене право щодо невиконання чи неналежного виконання Позичальником взятих на себе зобов&rsquo;язань згідно письмового договору позики та письмової розписки.</span></p>
<h2 class=""MsoNormal"" style=""text-align: justify; line-height: 150%; font-size: 15px; text-indent: 42.55pt;""><span lang=""UK"" style=""color: #000000; background: #ffffff;"">Адвокатське об&rsquo;єднання &laquo;Галицька правнича група&raquo; надасть консультації з приводу оформлення позики, допоможе кваліфіковано скласти договір позики та/або розписку, здійснить представництво сторін в суді.</span></h2>
<p><span lang=""UK"" style=""color: #000000; background: #ffffff;"">&nbsp; &nbsp; &nbsp; &nbsp; &nbsp; &nbsp;</span></p>
<h2 class=""MsoNormal"" style=""margin-bottom: .0001pt; text-align: justify;""><strong><u><span style=""font-size: 12.0pt; line-height: 115%; font-family: 'Times New Roman','serif';"">&nbsp; &nbsp; &nbsp; &nbsp; &nbsp; &nbsp; &nbsp; &nbsp;Адвокати у Львові, Тернополі, Луцьку, Івано-Франківську до Ваших послуг.</span></u></strong></h2>
<p class=""rvps2"" style=""margin: 0cm; line-height: 150%; font-size: 15px; margin-bottom: .0001pt; text-align: justify; text-indent: 35.45pt; background: white;""><span lang=""UK"" style=""color: #000000; background-color: #ffffff;"">&nbsp;</span></p>",8.png,2020-04-28 21:13:56,2020-04-02 08:55:24,5
