id,meta_title,meta_descr,alt,title,slug,body,image,updated,created,author
14,"Захист в кримінальних справах. Особливості захисту в економічних злочинах (привласнення, розтрата, заволодіння майном)","кримінальні справи, кримінальне провадження,  адвокат Львів, адвокат Тернопіль, адвокатські послуги, Конституційний суд, Верховний суд, Залізничний районний суд м. Львова, Апеляційний суд Львівської області",criminal_law,"Захист в кримінальних справах. Особливості захисту в економічних злочинах (привласнення, розтрата, заволодіння майном)",zahist-v-kriminalnih-spravah-osoblivosti-zahistu-v-ekonomichnih-zlochinah-privlasnennya-roztrata-zavolodinnya-majnom,"<h2 class=""MsoNormal"" style=""margin-bottom: .0001pt;""><span lang=""UK"" style=""font-size: 12.0pt; line-height: 115%; font-family: 'Times New Roman','serif'; mso-ansi-language: UK;"">АО &laquo;Галицька правнича група&raquo; здійснює успішний захист клієнтів у складних кримінальних провадженнях.</span></h2>
<p class=""MsoNormal"" style=""margin-bottom: 0.0001pt; text-align: justify;""><span lang=""UK"" style=""font-size: 12pt; line-height: 115%; font-family: 'times new roman', times, serif;"">На початку 2012 року до адвокатів звернулась Особа, засуджена Залізничним районний судом м. Львова за ч. 1 ст. 191 КК України до штрафу у розмірі 40 неоподаткованих мінімумів доходів громадян та стягнуто із Особа на користь ПАТ &laquo;Укртранснафта&raquo; в особі філії &laquo;Магістральні нафтопроводи &laquo;Дружба&raquo; - 55&nbsp;879 грн. 56 коп.</span></p>
<p class=""MsoNormal"" style=""margin-bottom: 0.0001pt; text-align: justify;""><span style=""font-family: 'times new roman', times, serif; font-size: 12pt;""><span lang=""UK"" style=""line-height: 115%;""><br />Адвокатом об</span><span style=""line-height: 115%;"">&rsquo;</span><span lang=""UK"" style=""line-height: 115%;"">єднання було подано апеляційну скаргу на вирок Залізничного районного суду м. Львова від 09 грудня 2011 року, де зокрема вказувалось, що:</span></span></p>
<h2 style=""margin: 0cm; margin-bottom: .0001pt; text-align: justify; text-indent: 2.0cm;""><span style=""font-family: 'times new roman', times, serif; font-size: 12pt;""><span style=""mso-ansi-language: RU;"">В</span><span lang=""UK"">ідповідно до постанови пленуму Верховного суду України № 10 від 6 листопада 2009 року &laquo;Про судову практику у справах про злочини проти власності&raquo;: &laquo;<strong style=""mso-bidi-font-weight: normal;"">У статті 191 КК передбачено відповідальність за три форми вчинення злочину &mdash; привласнення, розтрату або заволодіння майном шляхом зловживання службовим становищем. Вони характеризуються умисним протиправним і безоплатним оберненням чужого майна на свою користь чи на користь іншої особи. </strong></span></span></h2>
<p style=""margin: 0cm; margin-bottom: .0001pt; text-align: justify; text-indent: 2.0cm;""><span lang=""UK"" style=""font-family: 'times new roman', times, serif; font-size: 12pt;"">Предметом привласнення та розтрати є лише те чуже майно, яке було ввірене винній особі чи перебувало в її законному віданні, тобто таке майно, що знаходилося в неї на законних підставах і стосовно якого вона здійснювала повноваження щодо розпорядження, управління, доставки використання або зберігання тощо. <strong style=""mso-bidi-font-weight: normal;""><u>При привласненні ці повноваження використовуються для обернення винною особою майна на свою користь, а при розтраті &mdash; на користь інших осіб, зокрема це може бути відчуження майна іншим особам для споживання, як подарунок чи товар, в обмін на інше майно тощо. </u></strong></span></p>
<p style=""margin: 0cm; margin-bottom: .0001pt; text-align: justify; text-indent: 2.0cm;""><span lang=""UK"" style=""font-family: 'times new roman', times, serif; font-size: 12pt;"">Заволодіння чужим майном шляхом зловживання службовим становищем полягає в незаконному оберненні чужого майна на свою користь або на користь інших осіб з використанням службовою особою свого службового становища всупереч інтересам служби. </span></p>
<p style=""margin: 0cm; margin-bottom: .0001pt; text-align: justify; text-indent: 2.0cm;""><span lang=""UK"" style=""font-family: 'times new roman', times, serif; font-size: 12pt;"">Суб&rsquo;єктом привласнення, розтрати або заволодіння чужим майном шляхом зловживання службової особи своїм службовим становищем (частина друга статті 191 КК) може бути лише службова особа. Вирішуючи питання, чи є та або інша особа службовою, належить керуватися правилами, викладеними в пунктах 1 і 2 примітки до статті 364 КК&raquo;. </span></p>
<p class=""MsoNormal"" style=""margin-bottom: .0001pt; text-align: justify; text-indent: 2.0cm;""><span style=""font-family: 'times new roman', times, serif; font-size: 12pt;""><span style=""line-height: 115%;"">Також </span><span lang=""UK"" style=""line-height: 115%;"">він</span><span style=""line-height: 115%;""> вказував на те, що заправка знаходиться під охороною, а з 1993 року до жовтня 2010 року за час моєї діяльності не було жодної недостачі.</span></span></p>
<p class=""MsoNormal"" style=""margin-bottom: .0001pt; text-align: justify; text-indent: 2.0cm;""><span style=""font-family: 'times new roman', times, serif; font-size: 12pt;""><span style=""line-height: 115%;"">Коли прийшло нове керівництво і </span><span lang=""UK"" style=""line-height: 115%;"">його</span><span style=""line-height: 115%;""> захотіли звільнити з роботи </span><span lang=""UK"" style=""line-height: 115%;"">він</span><span style=""line-height: 115%;""> відповів, що звільнятись не збира</span><span lang=""UK"" style=""line-height: 115%;"">ється</span><span style=""line-height: 115%;""> і хоч</span><span lang=""UK"" style=""line-height: 115%;"">е</span><span style=""line-height: 115%;""> допрацювати на підприємстві до пенсійного віку. Після цього в </span><span lang=""UK"" style=""line-height: 115%;"">нього</span><span style=""line-height: 115%;""> почались проблеми.</span></span></p>
<p style=""margin: 0cm; margin-bottom: .0001pt; text-align: justify; text-indent: 2.0cm;""><span lang=""UK"" style=""font-family: 'times new roman', times, serif; font-size: 12pt;"">Відповідно до ст. 324 Кримінально-процесуального кодексу України: &laquo;Постановляючи вирок, суд повинен вирішити такі питання:</span></p>
<p><a name=""o440""></a><span style=""font-family: 'times new roman', times, serif; font-size: 12pt;""><span lang=""UK"" style=""color: black;"">1) чи мало місце діяння, у вчиненні якого обвинувачується підсудний;</span></span></p>
<p class=""MsoNormal"" style=""margin-bottom: .0001pt; text-align: justify; text-indent: 2.0cm; line-height: normal; tab-stops: 45.8pt 91.6pt 137.4pt 183.2pt 229.0pt 274.8pt 320.6pt 366.4pt 412.2pt 458.0pt 503.8pt 549.6pt 595.4pt 641.2pt 687.0pt 732.8pt;""><span style=""font-family: 'times new roman', times, serif; font-size: 12pt;""><span style=""color: black;"">2) чи має це діяння склад злочину і якою саме статтею кримінального закону він передбачений;</span></span></p>
<p class=""MsoNormal"" style=""margin-bottom: .0001pt; text-align: justify; text-indent: 2.0cm; line-height: normal; tab-stops: 45.8pt 91.6pt 137.4pt 183.2pt 229.0pt 274.8pt 320.6pt 366.4pt 412.2pt 458.0pt 503.8pt 549.6pt 595.4pt 641.2pt 687.0pt 732.8pt;""><span style=""font-size: 12pt; font-family: 'times new roman', times, serif; color: black;"">3) чи винен підсудний у вчиненні цього злочину;</span></p>
<p class=""MsoNormal"" style=""margin-bottom: .0001pt; text-align: justify; text-indent: 2.0cm; line-height: normal; tab-stops: 45.8pt 91.6pt 137.4pt 183.2pt 229.0pt 274.8pt 320.6pt 366.4pt 412.2pt 458.0pt 503.8pt 549.6pt 595.4pt 641.2pt 687.0pt 732.8pt;""><span style=""font-family: 'times new roman', times, serif; font-size: 12pt;""><span style=""color: black;"">4) чи підлягає підсудний покаранню за вчинений ним злочин;</span></span></p>
<p class=""MsoNormal"" style=""margin-bottom: .0001pt; text-align: justify; text-indent: 2.0cm; line-height: normal; tab-stops: 45.8pt 91.6pt 137.4pt 183.2pt 229.0pt 274.8pt 320.6pt 366.4pt 412.2pt 458.0pt 503.8pt 549.6pt 595.4pt 641.2pt 687.0pt 732.8pt;""><span style=""font-family: 'times new roman', times, serif; font-size: 12pt;""><span style=""color: black;"">5) чи є обставини, що обтяжують або пом'якшують покарання підсудного, і які саме; </span></span></p>
<p class=""MsoNormal"" style=""margin-bottom: .0001pt; text-align: justify; text-indent: 2.0cm; line-height: normal; tab-stops: 45.8pt 91.6pt 137.4pt 183.2pt 229.0pt 274.8pt 320.6pt 366.4pt 412.2pt 458.0pt 503.8pt 549.6pt 595.4pt 641.2pt 687.0pt 732.8pt;""><span style=""font-size: 12pt; font-family: 'times new roman', times, serif; color: black;"">6) яка саме міра покарання повинна бути призначена підсудному і чи повинен він її відбувати;</span></p>
<p class=""MsoNormal"" style=""margin-bottom: .0001pt; text-align: justify; text-indent: 2.0cm; line-height: normal; tab-stops: 45.8pt 91.6pt 137.4pt 183.2pt 229.0pt 274.8pt 320.6pt 366.4pt 412.2pt 458.0pt 503.8pt 549.6pt 595.4pt 641.2pt 687.0pt 732.8pt;""><span style=""font-size: 12pt; font-family: 'times new roman', times, serif; color: black;"">7) чи підлягає задоволенню пред'явлений цивільний позов, на чию<span style=""mso-spacerun: yes;"">&nbsp; </span>користь<span style=""mso-spacerun: yes;"">&nbsp; </span>та<span style=""mso-spacerun: yes;"">&nbsp; </span>в якому розмірі, і чи підлягають відшкодуванню збитки, заподіяні потерпілому, а також кошти, витрачені закладом охорони здоров'я на його стаціонарне лікування, якщо цивільний позов не був заявлений<a name=""o449""></a>&raquo;.</span></p>
<p class=""MsoNormal"" style=""margin-bottom: .0001pt; text-align: justify; text-indent: 2.0cm; tab-stops: 45.8pt 91.6pt 137.4pt 183.2pt 229.0pt 274.8pt 320.6pt 366.4pt 412.2pt 458.0pt 503.8pt 549.6pt 595.4pt 641.2pt 687.0pt 732.8pt;""><span style=""font-size: 12pt; line-height: 115%; font-family: 'times new roman', times, serif; color: black;"">Відповідно до ч. 1 ст. 334 Кримінально-процесуального кодексу України: &laquo;Мотивувальна частина обвинувального вироку повинна містити формулювання обвинувачення, визнаного судом доведеним, з зазначенням <strong style=""mso-bidi-font-weight: normal;"">місця, часу, способу вчинення та наслідків злочину, форми вини і мотивів злочину</strong>. В цій частині вироку наводяться обставини, які визначають ступінь тяжкості вчиненого злочину, та докази, на яких ґрунтується висновок суду щодо кожного підсудного, з зазначенням мотивів, з яких суд відкидає інші докази; обставини, що пом'якшують або обтяжують покарання; мотиви зміни обвинувачення; у разі визнання частини обвинувачення необгрунтованою &mdash; підстави для цього&raquo;.</span></p>
<h2 class=""MsoNormal"" style=""margin-bottom: .0001pt; text-align: justify; text-indent: 2.0cm; tab-stops: 45.8pt 91.6pt 137.4pt 183.2pt 229.0pt 274.8pt 320.6pt 366.4pt 412.2pt 458.0pt 503.8pt 549.6pt 595.4pt 641.2pt 687.0pt 732.8pt;""><span style=""font-size: 12pt; line-height: 115%; font-family: 'times new roman', times, serif; color: black;"">Адвокати, адвокат Львів, адвокат Тернопіль.</span></h2>
<p class=""MsoNormal"" style=""margin-bottom: .0001pt; text-align: justify; text-indent: 2.0cm; tab-stops: 45.8pt 91.6pt 137.4pt 183.2pt 229.0pt 274.8pt 320.6pt 366.4pt 412.2pt 458.0pt 503.8pt 549.6pt 595.4pt 641.2pt 687.0pt 732.8pt;""><span style=""font-size: 12pt; line-height: 115%; font-family: 'times new roman', times, serif; color: black;"">Так, суд у вироку зазначив, що в період часу з 26.10.2010 року по 12.03.2011 року розтратив паливно-мастильні матеріали, що було виявлено інвентаризаційною комісією 12.03.2011 року при проведенні інвентаризації пального в резервуарах АЗС.</span></p>
<p class=""MsoNormal"" style=""margin-bottom: .0001pt; text-align: justify; text-indent: 2.0cm; line-height: normal; tab-stops: 45.8pt 91.6pt 137.4pt 183.2pt 229.0pt 274.8pt 320.6pt 366.4pt 412.2pt 458.0pt 503.8pt 549.6pt 595.4pt 641.2pt 687.0pt 732.8pt;""><span style=""font-size: 12pt; font-family: 'times new roman', times, serif; color: black;"">В той же час суд не взяв до уваги, що інвентаризацією у резервуарах не виявлено недостачі. Недостачі не було виявлено і у цистерні бензовоза, але склад нафтопродуктів у цистерні бензовоза не відповідав техніко-економічним показникам і в зв&rsquo;язку з цим від загального об&rsquo;єму було відмінусовано об&rsquo;єм льоду та води за рахунок чого підприємство вважало, що йому завдано збитків.</span></p>
<p class=""MsoNormal"" style=""margin-bottom: .0001pt; text-align: justify; text-indent: 2.0cm; line-height: normal; tab-stops: 45.8pt 91.6pt 137.4pt 183.2pt 229.0pt 274.8pt 320.6pt 366.4pt 412.2pt 458.0pt 503.8pt 549.6pt 595.4pt 641.2pt 687.0pt 732.8pt;""><span style=""font-size: 12pt; font-family: 'times new roman', times, serif; color: black;"">Суд не вказав на те, що з 25.11.2010 року по 24.12.2010 року Особа знаходився на лікарняному та не міг здійснювати будь-якої розтрати, навпаки суд вказав, що і в період перебування на лікарняному Дуліба здійснював розтрату.</span></p>
<p class=""MsoNormal"" style=""margin-bottom: .0001pt; text-align: justify; text-indent: 2.0cm; line-height: normal; tab-stops: 45.8pt 91.6pt 137.4pt 183.2pt 229.0pt 274.8pt 320.6pt 366.4pt 412.2pt 458.0pt 503.8pt 549.6pt 595.4pt 641.2pt 687.0pt 732.8pt;""><span style=""font-family: 'times new roman', times, serif; font-size: 12pt;""><span style=""color: black;"">Суд не встановив, що в період лікарняного </span><span lang=""UK"" style=""color: black;"">Особи,</span><span style=""color: black;""> його функції виконував </span><span lang=""UK"" style=""color: black;"">Особа1</span><span style=""color: black;"">, суд не надав уваги тому, що під час перебування </span><span lang=""UK"" style=""color: black;"">Особи</span><span style=""color: black;""> на лікарняному як не було складено акту про передачу паливних матеріалів </span><span lang=""UK"" style=""color: black;"">Особі1</span><span style=""color: black;""> так і не складалось акту передачі паливних матеріалів </span><span lang=""UK"" style=""color: black;"">Особи1 Особі.</span></span></p>
<p class=""MsoNormal"" style=""margin-bottom: .0001pt; text-align: justify; text-indent: 2.0cm; line-height: normal; tab-stops: 45.8pt 91.6pt 137.4pt 183.2pt 229.0pt 274.8pt 320.6pt 366.4pt 412.2pt 458.0pt 503.8pt 549.6pt 595.4pt 641.2pt 687.0pt 732.8pt;""><span style=""font-size: 12pt; font-family: 'times new roman', times, serif; color: black;"">Наведене означає, що суд помилково вказав місце події замість цистерни &ndash; резервуар та час події також вказаний неправильно.</span></p>
<p class=""MsoNormal"" style=""margin-bottom: .0001pt; text-align: justify; text-indent: 2.0cm; line-height: normal; tab-stops: 45.8pt 91.6pt 137.4pt 183.2pt 229.0pt 274.8pt 320.6pt 366.4pt 412.2pt 458.0pt 503.8pt 549.6pt 595.4pt 641.2pt 687.0pt 732.8pt;""><span style=""font-family: 'times new roman', times, serif; font-size: 12pt;""><span style=""color: black;"">Крім цього суд не визначив способу вчинення злочину, оскільки не встановив як саме </span><span lang=""UK"" style=""color: black;"">Особа</span><span style=""color: black;""> добував з резервуарів паливно-мастильні матеріали та кому саме їх відпускав чи передавав та чим саме керувався </span><span lang=""UK"" style=""color: black;"">Особа</span><span style=""color: black;"">, передаючи паливно-мастильні матеріали.</span></span></p>
<p class=""MsoNormal"" style=""margin-bottom: .0001pt; text-align: justify; text-indent: 2.0cm; line-height: normal; tab-stops: 45.8pt 91.6pt 137.4pt 183.2pt 229.0pt 274.8pt 320.6pt 366.4pt 412.2pt 458.0pt 503.8pt 549.6pt 595.4pt 641.2pt 687.0pt 732.8pt;""><span style=""font-family: 'times new roman', times, serif; font-size: 12pt;""><span style=""color: black;"">Суд не встановлював чи був прямий умисел </span><span lang=""UK"" style=""color: black;"">Особа</span><span style=""color: black;""> на розтрату паливно-мастильних матеріалів чи причиною нестачі стала відсутність </span><span lang=""UK"" style=""color: black;"">Особа</span><span style=""color: black;""> на роботі; суд не встановлював чи недбалість </span><span lang=""UK"" style=""color: black;"">Особа</span><span style=""color: black;""> чи недбалість інших осіб по складанню документів про передачу майна під час перебування </span><span lang=""UK"" style=""color: black;"">Особа</span><span style=""color: black;""> на лікарняному призвели до втрати якості паливо-мастильних матеріалів, чи можливо втрата якості паливо-мастильних матеріалів спричинена не очищенням резервуарів з 1993 року.</span></span></p>
<p class=""MsoNormal"" style=""margin-bottom: .0001pt; text-align: justify; text-indent: 2.0cm; line-height: normal; tab-stops: 45.8pt 91.6pt 137.4pt 183.2pt 229.0pt 274.8pt 320.6pt 366.4pt 412.2pt 458.0pt 503.8pt 549.6pt 595.4pt 641.2pt 687.0pt 732.8pt;""><span style=""font-family: 'times new roman', times, serif; font-size: 12pt;""><span style=""color: black;"">Таким чином Залізничний районний суд м. Львова не зміг виконати встановлених вимог щодо форми вироку у зв&rsquo;язку з тим, що під час досудового слідства таких обставин не було встановлено, а отже не було зібрано доказів щодо кваліфікації діянь </span><span lang=""UK"" style=""color: black;"">Особа</span><span style=""color: black;""> за ст. 191 КК України.</span></span></p>
<p class=""MsoNormal"" style=""margin-bottom: .0001pt; text-align: justify; text-indent: 2.0cm; line-height: normal; tab-stops: 45.8pt 91.6pt 137.4pt 183.2pt 229.0pt 274.8pt 320.6pt 366.4pt 412.2pt 458.0pt 503.8pt 549.6pt 595.4pt 641.2pt 687.0pt 732.8pt;""><span style=""font-family: 'times new roman', times, serif; font-size: 12pt;""><span style=""color: black;"">Не описавши даних обставин у вироку суду Залізничний районний суд не обґрунтував правильність кваліфікації діянь </span><span lang=""UK"" style=""color: black;"">Особа</span><span style=""color: black;""> за ст. 191 КК України та підставність стягнення з </span><span lang=""UK"" style=""color: black;"">Особа </span><span style=""color: black;""><span style=""mso-spacerun: yes;"">&nbsp;</span>майнової шкоди.</span></span></p>
<p class=""MsoNormal"" style=""margin-bottom: .0001pt; text-align: justify; text-indent: 2.0cm; line-height: normal; tab-stops: 45.8pt 91.6pt 137.4pt 183.2pt 229.0pt 274.8pt 320.6pt 366.4pt 412.2pt 458.0pt 503.8pt 549.6pt 595.4pt 641.2pt 687.0pt 732.8pt;""><span style=""font-size: 12pt; font-family: 'times new roman', times, serif; color: black;"">Крім цього, відповідно до ст. 58 Конституції України: &laquo;Закони та інші нормативно-правові акти не мають зворотної дії в часі, крім випадків, коли вони пом&rsquo;якшують або скасовують відповідальність особи&raquo;.</span></p>
<p class=""MsoNormal"" style=""margin-bottom: .0001pt; text-align: justify; text-indent: 2.0cm; line-height: normal; tab-stops: 45.8pt 91.6pt 137.4pt 183.2pt 229.0pt 274.8pt 320.6pt 366.4pt 412.2pt 458.0pt 503.8pt 549.6pt 595.4pt 641.2pt 687.0pt 732.8pt;""><span style=""font-size: 12pt; font-family: 'times new roman', times, serif; color: black;"">Отже вирок слід скасувати з наступних підстав: </span></p>
<p class=""MsoNormal"" style=""margin-bottom: .0001pt; text-align: justify; text-indent: 2.0cm; line-height: normal; tab-stops: 45.8pt 91.6pt 137.4pt 183.2pt 229.0pt 274.8pt 320.6pt 366.4pt 412.2pt 458.0pt 503.8pt 549.6pt 595.4pt 641.2pt 687.0pt 732.8pt;""><span style=""font-family: 'times new roman', times, serif; font-size: 12pt;""><span style=""color: black;"">- </span><span lang=""UK"" style=""color: black;"">Особа</span><span style=""color: black;""> не було вручено обвинувального висновку;</span></span></p>
<p class=""MsoNormal"" style=""margin-bottom: .0001pt; text-align: justify; text-indent: 2.0cm; line-height: normal; tab-stops: 45.8pt 91.6pt 137.4pt 183.2pt 229.0pt 274.8pt 320.6pt 366.4pt 412.2pt 458.0pt 503.8pt 549.6pt 595.4pt 641.2pt 687.0pt 732.8pt;""><span style=""font-family: 'times new roman', times, serif; font-size: 12pt;""><span style=""color: black;"">- До </span><span lang=""UK"" style=""color: black;"">Особа</span><span style=""color: black;""> застосовано кримінальний закон, який не підлягає застосуванню, оскільки в моїх діях не доведено умислу про передачу майна та не доведено передачі мною паливно-мастильних матеріалів третім особам.</span></span></p>
<p class=""MsoNormal"" style=""margin-bottom: .0001pt; text-align: justify; text-indent: 2.0cm; line-height: normal; tab-stops: 45.8pt 91.6pt 137.4pt 183.2pt 229.0pt 274.8pt 320.6pt 366.4pt 412.2pt 458.0pt 503.8pt 549.6pt 595.4pt 641.2pt 687.0pt 732.8pt;""><span style=""font-family: 'times new roman', times, serif; font-size: 12pt;""><span lang=""UK"" style=""color: black;"">- </span><span style=""color: black;"">Самою інвентаризаційною комісією встановлено факт невідповідності техніко-економічних характеристик палива, з чого було здійснено розрахунок нестачі паливо-мастильних матеріалів.</span></span></p>
<p class=""MsoNormal"" style=""margin-bottom: .0001pt; text-align: justify; text-indent: 2.0cm; line-height: normal; tab-stops: 45.8pt 91.6pt 137.4pt 183.2pt 229.0pt 274.8pt 320.6pt 366.4pt 412.2pt 458.0pt 503.8pt 549.6pt 595.4pt 641.2pt 687.0pt 732.8pt;""><span lang=""UK"" style=""font-size: 12pt; font-family: 'times new roman', times, serif; color: black;"">&nbsp;</span></p>
<p class=""MsoNormal"" style=""margin-bottom: .0001pt; text-align: justify; text-indent: 2.0cm; line-height: normal; tab-stops: 45.8pt 91.6pt 137.4pt 183.2pt 229.0pt 274.8pt 320.6pt 366.4pt 412.2pt 458.0pt 503.8pt 549.6pt 595.4pt 641.2pt 687.0pt 732.8pt;""><span style=""font-family: 'times new roman', times, serif; font-size: 12pt;""><strong style=""mso-bidi-font-weight: normal;""><u><span lang=""UK"" style=""color: black;"">За результатами апеляційного розгляду справи відповідно до ухвали апеляційного суду Львівської області: в задоволенні апеляції Особа відмовити.</span></u></strong></span></p>
<p class=""MsoNormal"" style=""margin-bottom: .0001pt; text-align: justify; text-indent: 2.0cm; line-height: normal; tab-stops: 45.8pt 91.6pt 137.4pt 183.2pt 229.0pt 274.8pt 320.6pt 366.4pt 412.2pt 458.0pt 503.8pt 549.6pt 595.4pt 641.2pt 687.0pt 732.8pt;""><span style=""font-family: 'times new roman', times, serif; font-size: 12pt;""><strong style=""mso-bidi-font-weight: normal;""><u><span lang=""UK"" style=""color: black;"">Вирок Залізничного районного суду м. Львова від 09 грудня 2011 року відносно Особа залишити без змін.</span></u></strong></span></p>
<p class=""MsoNormal"" style=""margin-bottom: .0001pt; text-align: justify; text-indent: 2.0cm;""><span style=""font-family: 'times new roman', times, serif; font-size: 12pt;""><span lang=""UK"" style=""line-height: 115%; color: black;"">При поданні касаційної скарги, зокрема, було зазначено, що : &laquo;</span><span style=""line-height: 115%;"">Показання підозрюваного підлягають перевірці. <strong style=""mso-bidi-font-weight: normal;""><u>Визнання підозрюваним своєї вини може бути покладено в основу обвинувачення лише при підтвердженні цього визнання сукупністю доказів, що є в справі.</u></strong></span></span></p>
<h2 class=""MsoNormal"" style=""margin-bottom: .0001pt; text-align: justify; text-indent: 2.0cm;""><span style=""font-size: 12pt; line-height: 115%; font-family: 'times new roman', times, serif;"">Відповідно до ст. 74 КПК України: &laquo;Обвинувачений вправі давати показання по предявленому йому обвинуваченню, а також з приводу всіх інших відомих йому обставин у справі і доказів, що є в справі.</span></h2>
<h2 class=""MsoNormal"" style=""margin-bottom: .0001pt; text-align: justify; text-indent: 2.0cm;""><span style=""font-size: 12pt; line-height: 115%; font-family: 'times new roman', times, serif;"">Показання обвинуваченого, в тому числі й такі, в яких він визнає себе виним, підлягають перевірці. Визнання обвинуваченим своєї вини може бути покладено в основу обвинувачення лише при підтвердженні цього визнання сукупністю доказів, що є в справі.</span></h2>
<h2 class=""MsoNormal"" style=""margin-bottom: .0001pt; text-align: justify; text-indent: 2.0cm;""><span style=""font-size: 12pt; line-height: 115%; font-family: 'times new roman', times, serif;"">Відповідно до ст. 140 КПК України: &laquo;<strong style=""mso-bidi-font-weight: normal;"">При пред&rsquo;явленні обвинувачення особі присутність захисника є обов&rsquo;язковою, крім випадків, коли він відмовляється від нього і його відмова прийнята</strong>&raquo;.</span></h2>
<h2 class=""MsoNormal"" style=""margin-bottom: .0001pt; text-align: justify; text-indent: 2.0cm;""><span style=""font-size: 12pt; line-height: 115%; font-family: 'times new roman', times, serif;"">Відповідно до ч. 1 ст. 299 КПК України: &laquo;Після виконання зазначених у попередній статті дій головуючий з&rsquo;ясовує думку учасників судового розгляду про те, які докази треба дослідити, та про порядок їх дослідження&raquo;.</span></h2>
<h2 class=""MsoNormal"" style=""margin-bottom: .0001pt; text-align: justify; text-indent: 2.0cm;""><span style=""font-size: 12pt; line-height: 115%; font-family: 'times new roman', times, serif;""><span style=""mso-spacerun: yes;"">&nbsp;</span>Відповідно до ч. 2 ст. 299 КПК України: &laquo;Обсяг доказів, які будуть досліджуватися, та порядок їх дослідження визначається постановою судді чи ухвалою суду&raquo;.</span></h2>
<p class=""MsoNormal"" style=""margin-bottom: .0001pt; text-align: justify; text-indent: 2.0cm;""><span style=""font-family: 'times new roman', times, serif; font-size: 12pt;""><span style=""line-height: 115%;"">Суд не взяв до уваги протоколу допиту підозрюваного </span><span lang=""UK"" style=""line-height: 115%;"">Особи</span><span style=""line-height: 115%;""> (а.с. 78), де він вказує: &laquo;Яким чином зникло я повідомити не можу, можу повідомити, що це сталося по моїй провині&raquo;.</span></span></p>
<p class=""MsoNormal"" style=""margin-bottom: .0001pt; text-align: justify; text-indent: 2.0cm;""><span style=""font-family: 'times new roman', times, serif; font-size: 12pt;""><span style=""line-height: 115%;"">Суд не взяв до уваги протокол допиту обвинуваченого </span><span lang=""UK"" style=""line-height: 115%;"">Особи</span><span style=""line-height: 115%;""> від 20.09.2011 року (а.с. 87), де обвинувачений вказує: &laquo;Можу сказати, що недостача палива на АЗС стала тільки через мою вину, оскільки я за це відповідаю, як це сталося пояснити не можу&raquo;.</span></span></p>
<h2 class=""MsoNormal"" style=""margin-bottom: .0001pt; text-align: justify; text-indent: 2.0cm; line-height: normal; tab-stops: 45.8pt 91.6pt 137.4pt 183.2pt 229.0pt 274.8pt 320.6pt 366.4pt 412.2pt 458.0pt 503.8pt 549.6pt 595.4pt 641.2pt 687.0pt 732.8pt;""><span lang=""UK"" style=""font-size: 12pt; font-family: 'times new roman', times, serif; color: black;"">Відповідно до ухвали Вищого спеціалізованого суду України від 27 листопада 2012 року зазначається:</span></h2>
<h2 class=""MsoNormal"" style=""margin-bottom: .0001pt; text-align: justify; text-indent: 2.0cm; line-height: normal; tab-stops: 45.8pt 91.6pt 137.4pt 183.2pt 229.0pt 274.8pt 320.6pt 366.4pt 412.2pt 458.0pt 503.8pt 549.6pt 595.4pt 641.2pt 687.0pt 732.8pt;""><span lang=""UK"" style=""font-size: 12pt; font-family: 'times new roman', times, serif; color: black;"">&laquo;Проте, як убачається з показань засудженого, він фактично не визнав себе винуватим у злочині, передбаченому ч. 1 ст. 191 КК України, стверджуючи на питання головуючого, що не знає яким чином допустив розтрату пального.</span></h2>
<p class=""MsoNormal"" style=""margin-bottom: .0001pt; text-align: justify; text-indent: 2.0cm; line-height: normal; tab-stops: 45.8pt 91.6pt 137.4pt 183.2pt 229.0pt 274.8pt 320.6pt 366.4pt 412.2pt 458.0pt 503.8pt 549.6pt 595.4pt 641.2pt 687.0pt 732.8pt;""><span lang=""UK"" style=""font-size: 12pt; font-family: 'times new roman', times, serif; color: black;"">Суд першої інстанції не взяв до уваги цих показань Особа та, не досліджуючи інших доказів у оспорюваній частині обвинувачення, вказав у мотивувальній частині вироку на повне визнання засудженим своєї вини та навів показання Дуліби, які суперечать його ж показанням, викладеним у протоколі судового засідання. </span></p>
<p class=""MsoNormal"" style=""margin-bottom: .0001pt; text-align: justify; text-indent: 2.0cm; line-height: normal; tab-stops: 45.8pt 91.6pt 137.4pt 183.2pt 229.0pt 274.8pt 320.6pt 366.4pt 412.2pt 458.0pt 503.8pt 549.6pt 595.4pt 641.2pt 687.0pt 732.8pt;""><span lang=""UK"" style=""font-size: 12pt; font-family: 'times new roman', times, serif; color: black;"">При перевірці справи апеляційний суд не звернув уваги на допущені районним судом зазначені порушення процесуального закону та у порушення вимог ст. 365 КПК України залишив по суті незаконне судове рішення без зміни.</span></p>
<p class=""MsoNormal"" style=""margin-bottom: .0001pt; text-align: justify; text-indent: 2.0cm; line-height: normal; tab-stops: 45.8pt 91.6pt 137.4pt 183.2pt 229.0pt 274.8pt 320.6pt 366.4pt 412.2pt 458.0pt 503.8pt 549.6pt 595.4pt 641.2pt 687.0pt 732.8pt;""><span lang=""UK"" style=""font-size: 12pt; font-family: 'times new roman', times, serif; color: black;"">За таких обставин судові рішення підлягають скасуванню з направленням справи на новий судовий розгляд, під час якого суду необхідно провести судове слідство у відповідності до вимог кримінально-процесуального закону та постановити законне й обгрунтоване рішення&raquo;.</span></p>
<h2 class=""MsoNormal"" style=""margin-bottom: .0001pt; text-align: justify; text-indent: 2.0cm; line-height: normal; tab-stops: 45.8pt 91.6pt 137.4pt 183.2pt 229.0pt 274.8pt 320.6pt 366.4pt 412.2pt 458.0pt 503.8pt 549.6pt 595.4pt 641.2pt 687.0pt 732.8pt;""><span lang=""UK"" style=""font-size: 12pt; font-family: 'times new roman', times, serif; color: black;"">Відтак вирок Залізничного районного суду м. Львова від 9 грудня 2011 року та ухвалу Апеляційного суду Львівської області від 22 травня 2012 року щодо Особа було скасовано, справу направити на новий судовий розгляд.</span></h2>
<h2 style=""margin: 0cm; margin-bottom: .0001pt; text-align: justify;""><span style=""font-family: 'times new roman', times, serif; font-size: 12pt;""><span lang=""UK"">Після цього, справа розглядалась трьома складами суду і 16 травня 2016 року відповідно до постанови Залізничного районного суду м. Львова: &laquo;</span><span lang=""UK"" style=""mso-fareast-language: RU;"">Звільнити від кримінальної відповідальності ОСОБА за обвинуваченням у скоєнні злочину, передбаченого</span><span style=""mso-ansi-language: RU; mso-fareast-language: RU;"">&nbsp;</span><span lang=""UK""><a title=""Кримінальний кодекс України; нормативно-правовий акт № 2341-III від 05.04.2001"" href=""http://search.ligazakon.ua/l_doc2.nsf/link1/an_1019/ed_2016_05_01/pravo1/T012341.html?pravo=1#1019"" target=""_blank"" rel=""noopener""><span style=""color: blue; mso-fareast-language: RU;"">ст.191 ч.1 КК України</span></a></span><span lang=""UK"" style=""mso-fareast-language: RU;"">, на підставі</span><span style=""mso-ansi-language: RU; mso-fareast-language: RU;"">&nbsp;</span><span lang=""UK""><a title=""Кримінальний кодекс України; нормативно-правовий акт № 2341-III від 05.04.2001"" href=""http://search.ligazakon.ua/l_doc2.nsf/link1/an_187/ed_2016_05_01/pravo1/T012341.html?pravo=1#187"" target=""_blank"" rel=""noopener""><span style=""color: blue; mso-fareast-language: RU;"">ст.49 ч.1 п.3 КК України</span></a></span><span lang=""UK"" style=""mso-fareast-language: RU;"">.</span></span></h2>
<p class=""MsoNormal"" style=""margin-bottom: .0001pt; text-align: justify; line-height: normal;""><span style=""font-family: 'times new roman', times, serif; font-size: 12pt;""><span style=""color: black;"">Закрити кримінальну справу відносно ОСОБА за обвинуваченням у скоєнні злочину, передбаченого&nbsp;</span><a title=""Кримінальний кодекс України; нормативно-правовий акт № 2341-III від 05.04.2001"" href=""http://search.ligazakon.ua/l_doc2.nsf/link1/an_1019/ed_2016_05_01/pravo1/T012341.html?pravo=1#1019"" target=""_blank"" rel=""noopener""><span style=""color: blue;"">ст.191 ч.1 КК України</span></a><span style=""color: black;"">, у зв'язку із закінченням строків давності</span><span lang=""UK"" style=""color: black;"">&raquo;</span><span style=""color: black;"">.</span></span></p>
<p class=""MsoNormal"" style=""margin-bottom: .0001pt; text-align: justify; line-height: normal;""><span lang=""UK"" style=""font-size: 12pt; font-family: 'times new roman', times, serif; color: black;"">В той же час, потерпілим було подано цивільний позов про стягнення коштів. </span></p>
<p class=""MsoNormal"" style=""margin-bottom: .0001pt; text-align: justify; line-height: normal;""><span style=""font-family: 'times new roman', times, serif; font-size: 12pt;""><span lang=""UK"" style=""color: black;"">Цивільне позов задоволено не було, а розгляд даної цивільної справи було припинено у 2020 році шляхом закриття провадження в зв</span><span style=""color: black;"">&rsquo;</span><span lang=""UK"" style=""color: black;"">язку зі смертю особи.</span></span></p>
<p class=""MsoNormal"" style=""margin-bottom: .0001pt; text-align: justify; line-height: normal;""><span lang=""UK"" style=""font-size: 12pt; font-family: 'times new roman', times, serif; color: black;"">Незважаючи, що особу засуджено не було, а цивільний позов не було задоволено, результат даної справи міг би бути набагато кращим, а саме Особа &ndash; виправданою, а сам судовий процес набагато швидшим, якби Особа ще на початку відкриття кримінального провадження звернулась до адвоката, і не наробила стільки помилок, як то при наявності багатьох зауважень до акту інвентаризації, не виклала свої зауваження, а беззастережно підписала акт інвентаризації.</span></p>
<p class=""MsoNormal"" style=""margin-bottom: .0001pt; text-align: justify; line-height: normal;""><span lang=""UK"" style=""font-size: 12pt; font-family: 'times new roman', times, serif; color: black;"">На досудовому слідстві Особа послухала порад слідчих, не взяла захисника, а визнала свою вину. В районному суді Особа також не взяла захисника, а визнала свою вину. І лише після того, коли з виконавчої служби прийшла постанова про відкриття виконавчого провадження, Особа почала шукати адвоката для оскарження судових рішень, вже будучи засудженою, та ще й з пропуском строку на апеляційне оскарження.</span></p>
<p class=""MsoNormal"" style=""margin-bottom: .0001pt; text-align: justify; line-height: normal;""><span style=""font-family: 'times new roman', times, serif; font-size: 12pt;""><span lang=""UK"">Крім того, необхідно розмежовувати ч.2 ст. 191 КК України(</span><span lang=""UK"" style=""background: white;"">Привласнення, розтрата або заволодіння чужим майном шляхом зловживання службовою особою своїм службовим становищем)</span><span lang=""UK""> та ст. 364 КК України(</span><span lang=""UK"" style=""background: white;"">Зловживання владою або службовим становищем, тобто умисне, з метою одержання будь-якої неправомірної вигоди для самої себе чи іншої фізичної або юридичної особи використання службовою особою влади чи службового становища всупереч інтересам служби, якщо воно завдало істотної шкоди охоронюваним законом правам, свободам та інтересам окремих громадян або державним чи громадським інтересам, або інтересам юридичних осіб) відмінність яких полягає в </span><span lang=""UK"">тому, що у разі, коли зловживання службовою особою своїм службовим становищем виступає способом розкрадання чужого майна, при якому винний незаконно вилучає та безоплатно обертає майно на свою користь чи користь третіх осіб, то такі дії утворюють спеціальний склад зловживання службовим становищем і мають кваліфікуватися за ст. 191 КК. </span>У той же час, якщо зловживання службовим становищем не супроводжується розкраданням чужого майна в будь-якій формі, не пов&rsquo;язано з протиправним вилученням та безоплатним оберненням такого майна у свою власність чи власність третіх осіб, а призводить до набуття іншої вигоди, то ці дії охоплюються диспозицією ст. 364 КК.</span></p>
<p class=""MsoNormal"" style=""margin-bottom: .0001pt; text-align: justify; line-height: normal;""><span lang=""UK"" style=""font-size: 12pt; font-family: 'times new roman', times, serif;"">При розгляді даної категорії справ важливим є визначення форми умислу, мотивів злочину та у випадку ч. 2 ст. 191 КК України: ознак, за якими обвинуваченого віднесено до службових осіб, має наслідком його невідповідність вимогам кримінального процесуального закону.</span></p>
<p class=""MsoNormal"" style=""margin-bottom: .0001pt; text-align: justify; line-height: normal;""><span style=""font-family: 'times new roman', times, serif; font-size: 12pt;""><span lang=""UK"">Таким чином, слід завжди звертати увагу, що </span><span style=""background: white;"">У статті 191 КК передбачено</span> <span style=""background: white;"">відповідальність</span> <span style=""background: white;"">за три форми вчинення злочину - привласнення, розтрату або</span> <span style=""background: white;"">заволодіння майном шляхом зловживання службовим становищем. Вони</span> <span style=""background: white;"">характеризуються умисним протиправним і безоплатним оберненням чужого майна на</span> <span style=""background: white;"">свою користь чи на користь іншої особи.</span></span></p>
<h2 class=""MsoNormal"" style=""margin-bottom: .0001pt; text-align: justify; line-height: normal;""><span style=""font-family: 'times new roman', times, serif; font-size: 12pt;""><span lang=""UK"" style=""color: black;"">Адвокати АО &laquo;Галицька правнича група&raquo; допоможуть Вам не допустити помилок як на досудовому розслідуванні, так і в суді захищаючи Вас у кримінальних справах з найбільш сприятливим для Вас результатом, допоможуть Вам у виборі стратегії захисту, правової позиції по справі, допомозі у зборі доказів, які виключають Вашу винуватість або пом</span><span style=""color: black;"">&rsquo;</span><span lang=""UK"" style=""color: black;"">якшують відповідальність, проведенні незалежних експертиз, візьмуть участь при проведенні слідчих дій з метою недопустити порушення Ваших прав з боку правоохоронних органів, а в подальшому ефективно захистять Вас на судовому слідстві.</span></span></h2>
<h2 class=""MsoNormal"" style=""margin-bottom: .0001pt; text-align: justify;""><span lang=""UK"" style=""font-size: 12pt; line-height: 115%; font-family: 'times new roman', times, serif;"">&nbsp;</span></h2>",criminal_law.png,2020-07-21 22:34:55,2020-07-21 14:12:07,8
